{
 "claim_status": "CORPUS_CLAIMED",
 "context": {
  "bytes": 1590445,
  "reading_anchor": "pm-s7",
  "tier": "T4",
  "tokenizer": "o200k_base",
  "tokens": 449080
 },
 "coordinate": "EN-110-000-0003-2-2026-PR-T4-UK-EX-M2-C-TO-H-0179",
 "domains": [
  {
   "applies": false,
   "basis": "inferred",
   "contract_anchor": "pm-s5",
   "domain": "software",
   "maturity": "not_applicable",
   "proposed_domain": null,
   "strength": "none",
   "verification": "PENDING"
  },
  {
   "applies": false,
   "basis": "inferred",
   "contract_anchor": "pm-s5",
   "domain": "games_simulation",
   "maturity": "not_applicable",
   "proposed_domain": null,
   "strength": "none",
   "verification": "PENDING"
  },
  {
   "applies": false,
   "basis": "inferred",
   "contract_anchor": "pm-s5",
   "domain": "tools",
   "maturity": "not_applicable",
   "proposed_domain": null,
   "strength": "none",
   "verification": "PENDING"
  },
  {
   "applies": true,
   "basis": "inferred",
   "contract_anchor": "pm-s5",
   "domain": "algorithms",
   "maturity": "adaptable",
   "proposed_domain": null,
   "strength": "moderate",
   "verification": "PENDING"
  },
  {
   "applies": false,
   "basis": "inferred",
   "contract_anchor": "pm-s5",
   "domain": "data_structures",
   "maturity": "not_applicable",
   "proposed_domain": null,
   "strength": "none",
   "verification": "PENDING"
  },
  {
   "applies": false,
   "basis": "inferred",
   "contract_anchor": "pm-s5",
   "domain": "hardware_accelerators",
   "maturity": "not_applicable",
   "proposed_domain": null,
   "strength": "none",
   "verification": "PENDING"
  },
  {
   "applies": false,
   "basis": "inferred",
   "contract_anchor": "pm-s5",
   "domain": "crypto_security",
   "maturity": "not_applicable",
   "proposed_domain": null,
   "strength": "none",
   "verification": "PENDING"
  },
  {
   "applies": false,
   "basis": "inferred",
   "contract_anchor": "pm-s5",
   "domain": "machine_learning",
   "maturity": "not_applicable",
   "proposed_domain": null,
   "strength": "none",
   "verification": "PENDING"
  },
  {
   "applies": true,
   "basis": "inferred",
   "contract_anchor": "pm-s5",
   "domain": "optimisation_operations_research",
   "maturity": "adaptable",
   "proposed_domain": null,
   "strength": "moderate",
   "verification": "PENDING"
  },
  {
   "applies": false,
   "basis": "inferred",
   "contract_anchor": "pm-s5",
   "domain": "distributed_systems",
   "maturity": "not_applicable",
   "proposed_domain": null,
   "strength": "none",
   "verification": "PENDING"
  },
  {
   "applies": false,
   "basis": "inferred",
   "contract_anchor": "pm-s5",
   "domain": "other",
   "maturity": "not_applicable",
   "proposed_domain": null,
   "strength": "none",
   "verification": "PENDING"
  }
 ],
 "exclusions": [
  {
   "evidence": [
    {
     "anchor": "eq:intro-full",
     "quote": "At $p=3$, the estimate holds with every positive Sobolev loss; the lossless estimate $\\varepsilon=0$ is not addressed.",
     "quote_sha256": "44088b2f698c4df2b38dd5e3d725d3450072a573c533c4bbaacc23531c3215f6"
    }
   ],
   "query": "Lossless critical half-wave estimate",
   "reason": "The result allows every positive Sobolev loss and does not address the lossless endpoint."
  },
  {
   "evidence": [
    {
     "anchor": "pm-h-3",
     "quote": "These distinctions explain the Euclidean qualification in the conjecture considered here.",
     "quote_sha256": "7fcb310c6ad6ab1efac448db280f4236dd2a5d8e34f1831230f595fc703acf48"
    }
   ],
   "query": "General manifold critical local smoothing",
   "reason": "The Euclidean theorem does not supply the corresponding critical conclusion for general curved geometries."
  },
  {
   "evidence": [
    {
     "anchor": "stmt-cor-br-nonmaximal",
     "quote": "For $1\\le p\\le\\infty$, with $1/\\infty=0$, set $$\\delta_{\\mathrm{BR}}(p)\n =\\max\\left\\{3\\left|\\frac1p-\\frac12\\right|-\\frac12,0\\right\\}.$$",
     "quote_sha256": "ecb83309febecbac9b4fdfa33793dab08931bd65382160249c1b774c76e3721e"
    }
   ],
   "query": "Maximal Bochner–Riesz estimates throughout the nonmaximal range",
   "reason": "Interpolation and duality here apply to individual fixed-radius operators; the maximal conclusion keeps its separate range."
  },
  {
   "evidence": [
    {
     "anchor": "proof-stmt-lem-fw-uniform",
     "quote": "It is not uniform when those bounds grow along an outer approximation.",
     "quote_sha256": "90485130f853467fa5b7f1bc348e0be7200a7d60c27900117070d73f41fabb5b"
    }
   ],
   "query": "Uniform constants while setup bounds grow with scale",
   "reason": "Fixed-setup uniformity cannot be extended to unbounded outer setup parameters."
  },
  {
   "evidence": [
    {
     "anchor": "stmt-names-score-law-change",
     "quote": "The latter assertion is not made for events whose probabilities merely have exponent zero.",
     "quote_sha256": "216cfadb367a09d5584554ca6f25716ab20538b4b58d67640dd883e805f0b049"
    }
   ],
   "query": "Automatic mutual-information stability under subpower restrictions",
   "reason": "The stated information preservation theorem requires a probability bounded below; exponent-zero probability alone is insufficient."
  }
 ],
 "family": "PM-079",
 "id": "PM-079.1",
 "inputs": {
  "hypotheses": [
   {
    "anchor": "stmt-thm-main",
    "claim_id": "claim-critical-local-smoothing",
    "statement": "$f\\in\\mathcal S(\\mathbb R^3)$"
   },
   {
    "anchor": "stmt-lem-fw-uniform",
    "claim_id": "claim-fixed-setup-uniformity",
    "statement": "Suppose $\\Gamma\\in\\mathbb R$"
   },
   {
    "anchor": "stmt-lem-fw-uniform",
    "claim_id": "claim-fixed-setup-uniformity",
    "statement": "Fix a family $\\mathcal A_s$ such that every sequence of choices $\\mathcal E_k\\in\\mathcal A_{s_k}$, $s_k\\to0$, is admissible in one fixed polynomial setup."
   },
   {
    "anchor": "stmt-lem-fw-energy",
    "claim_id": "claim-row-energy-and-copies",
    "statement": "Let $V:\\mathcal H\\to\\mathcal K$ be an isometry and let $P_1,\\ldots,P_N$ be mutually orthogonal projections on $\\mathcal K$."
   },
   {
    "anchor": "stmt-lem-fw-finite-extraction",
    "claim_id": "claim-finite-class-extraction",
    "statement": "Let $q\\ge1$,"
   },
   {
    "anchor": "stmt-lem-fw-finite-extraction",
    "claim_id": "claim-finite-class-extraction",
    "statement": "and suppose that a nonnegative functional $F$ satisfies $$F(g_1+\\cdots+g_N)^{1/q}\n \\le\\sum_{j=1}^N F(g_j)^{1/q}.$$"
   },
   {
    "anchor": "stmt-lem-fw-closure",
    "claim_id": "claim-extremal-slice-attainment",
    "statement": "Let $K\\subset\\mathbb R^{m+1}$ be a nonempty compact set of feasible limiting data $(g,x_1,\\ldots,x_m)$."
   },
   {
    "anchor": "stmt-lem-fw-strict-improvement",
    "claim_id": "claim-closed-slice-strict-improvement",
    "statement": "Let $K\\subset\\mathbb R^{k+1}$ be a closed set of feasible data."
   },
   {
    "anchor": "stmt-lem-fw-strict-improvement",
    "claim_id": "claim-closed-slice-strict-improvement",
    "statement": "Suppose that $c_0$ is the minimum of the last coordinate $c$ on the nonempty slice $K\\cap\\{z=z_0\\}$."
   },
   {
    "anchor": "stmt-lem-fw-pullback",
    "claim_id": "claim-strict-exponent-pullback",
    "statement": "Let $\\Gamma\\in\\mathbb R$ be an upper exponent"
   },
   {
    "anchor": "stmt-lem-fw-pullback",
    "claim_id": "claim-strict-exponent-pullback",
    "statement": "Suppose that, for each integer $m$, a construction produces an admissible sequence in a fixed setup $\\mathscr S_m$ with upper exponent at least $\\Gamma+\\tau-r_m$, where $\\tau>0$ is fixed and $r_m\\to0$."
   },
   {
    "anchor": "stmt-lem-fw-capacity",
    "claim_id": "claim-finite-name-capacity-tails",
    "statement": "Suppose that, given $Y$, the variable $X$ has at most $N$ possible values almost surely."
   },
   {
    "anchor": "stmt-lem-fw-restriction",
    "claim_id": "claim-score-restriction-stability",
    "statement": "Let $Q=P(\\,\\cdot\\mid E)$, where $P(E)=q>0$,"
   },
   {
    "anchor": "stmt-lem-fw-restriction",
    "claim_id": "claim-score-restriction-stability",
    "statement": "If $q\\ge s^\\alpha$,"
   },
   {
    "anchor": "stmt-lem-fw-information",
    "claim_id": "claim-positive-restriction-information",
    "statement": "Let $U,V$ be finite names, with arbitrary conditioning data $Y$."
   },
   {
    "anchor": "stmt-lem-fw-information",
    "claim_id": "claim-positive-restriction-information",
    "statement": "If $Q=P(\\,\\cdot\\mid E)$ and $P(E)\\ge q_0>0$,"
   },
   {
    "anchor": "stmt-cyl-localization",
    "claim_id": "claim-cylinder-symmetries-locality",
    "statement": "For $\\ell'\\le\\ell$, $|t|\\le C\\ell$,"
   },
   {
    "anchor": "stmt-cyl-polynomial-tests",
    "claim_id": "claim-polynomial-test-reduction",
    "statement": "At every stage of a polynomial setup,"
   },
   {
    "anchor": "stmt-thm-cylinder",
    "claim_id": "claim-cylinder-exponent-bound",
    "statement": "For the classical and hybrid cylinder experiments with the regularity weight parameter $0<\\eta<1$,"
   },
   {
    "anchor": "stmt-cyl-one-time",
    "claim_id": "claim-cylinder-single-time",
    "statement": "For a polynomial test at a cut of length $\\ell$,"
   },
   {
    "anchor": "stmt-cyl-one-time",
    "claim_id": "claim-cylinder-single-time",
    "statement": "an experiment with $\\kappa$-regular input"
   },
   {
    "anchor": "stmt-cyl-peeling",
    "claim_id": "claim-cylinder-regularity-peeling",
    "statement": "At a fixed cut,"
   },
   {
    "anchor": "stmt-cyl-split-saturation",
    "claim_id": "claim-preserving-split-saturation",
    "statement": "Suppose a non-remainder level supplied by Lemma <a href=\"#cyl:peeling\" data-reference-type=\"ref\" data-reference=\"cyl:peeling\">21</a> at depth $a\\in(0,1)$ preserves this exponent."
   },
   {
    "anchor": "stmt-cyl-matched-chain",
    "claim_id": "claim-matched-gate-chain",
    "statement": "an extremizing family"
   },
   {
    "anchor": "stmt-cyl-intersection",